Approval,GMDN,GMDN Description,Recommended UNSPSC,UNSPSC Description,
,58716,Knee tibia trial prosthesis,42322101,Knee trial implant sizers,
,58772,Femoral head sphericity template,42293004,Surgical sizing instruments or templates,
,58776,"Surgical screwdriver, single-use, sterile",42292402,Surgical drivers,
,58784,"Humeral head trial prosthesis, reusable",42321902,Humeral heads,
,58804,"Surgical implant template, single-use",42293004,Surgical sizing instruments or templates,
,58856,"Invasive breast implant sizer, reusable",42295536,Breast implant volume mammary sizers,
,58864,Endometrial-ablation hyperthermia catheter,42295803,Surgical thermo ablation catheters,
,58865,Vascular catheter introduction set,42203403,Diagnostic or interventional vascular catheter introducers,
,58908,"Cranial bone prosthesis, custom-made",42242002,Upper extremity prosthetic devices,
,58910,Total knee prosthesis implantation guide-instrument kit,42321808,Total knee replacement kits or systems,
,58927,"Orthopaedic prosthesis implantation instrument, single-use",42296816,Orthopedic surgical instruments,
,58984,Intraoperative freestanding patient positioning frame,42295111,Operating room patient positioning devices for general use,
,59009,Orthopaedic implant/instrument assembling device,42296816,Orthopedic surgical instruments,
,59036,Tissue expander injection port,42295509,Plastic or cosmetic tissue expanders or sets,
,59230,"Hypodermic needle, single-use, sterile",42142523,Hypodermic needle,
,59281,Antisnoring mucosa lubricant,42181503,Exam or personal lubricants or jellies,
,59676,"Pelvic organ prolapse surgical mesh, composite-polymer",42295513,Surgical mesh or tissue barriers,
,59688,Femoral head/stem prosthesis adaptor,42321710,Femoral modular hip component adapters,
,59870,"Open-surgery manual linear cutting stapler, single-use",42312009,Medical staplers for internal use,
,59871,"Endoscopic manual linear cutting stapler, single-use",42312009,Medical staplers for internal use,
,59872,"Open-surgery manual linear stapler, reusable",42312009,Medical staplers for internal use,
,59873,"Open-surgery manual linear stapler, single-use",42312009,Medical staplers for internal use,
,59874,Endoscopic manual linear stapler,42312009,Medical staplers for internal use,
,59875,"Intraluminal circular stapler, single-use",42312009,Medical staplers for internal use,
,60300,"Abdominal hernia surgical mesh, synthetic polymer",42295513,Surgical mesh or tissue barriers,
,60367,"Cervical spine immobilization system, single-use",42321518,External bone fixation sets,
,60447,Surgical power tool maintenance adaptor,42295215,Surgical power equipment accessories,
,60512,Shoulder humeral body prosthesis,42321911,Humeral bodies,
,60516,Metallic acetabulum prosthesis,42321714,Acetabular augments,
,60538,IV line/syringe Luer connector,42212306,Syringe adaptors or holders,
,60540,Intravenous fluid bag spike,42221611,Intravenous tubing spikes or caps or protectors,
,60637,"Vascular embolization coil detacher, single-use", ,#N/A,
,60762,"Polymeric spinal fusion cage, non-sterile",42321605,Spinal interbody cages or spacers,
,60842,"Pelvic organ prolapse surgical mesh, synthetic polymer",42295513,Surgical mesh or tissue barriers,
,60847,"Polymeric spinal fusion cage, sterile",42321605,Spinal interbody cages or spacers,
,60931,Reverse shoulder head trial prosthesis,42293004,Surgical sizing instruments or templates,
,60936,Humeral stem trial prosthesis,42321903,Humeral stems,
,60937,Reverse shoulder cup trial prosthesis,42293004,Surgical sizing instruments or templates,
,60939,Neurovascular embolization plug, ,#N/A,
,60940,Neurovascular embolization coil,42203413,Vascular coils,
,61029,Screw-extraction orthopaedic reamer,42295204,Surgical power reamers,
,61085,Powered bone mill motor,42295215,Surgical power equipment accessories,
,61118,Cerebrospinal fluid catheter connector,42293520,Irrigation or suction handpiece or cannula or tip or catheter accessories,
,61123,Ventriculo-peritoneal/atrial shunt,42295512,Surgical implantable shunts or shunt extenders,
,61154,"Flexible bone nail, non-sterile",42321504,Intramedullary nails or rods,
,61158,Atrial cerebrospinal fluid catheter,42293501,Irrigation or suction handpieces or cannulas or tips or catheters,
,61159,Peritoneal/atrial cerebrospinal fluid catheter,42161506,Peritoneal dialysis catheters or indwelling access devices,
,61211,"Manual orthopaedic bender, single-use",42292301,Surgical bending instruments,
,61271,Femoral stem centralizer,42321705,Femoral stem distal centralizers,
,61286,Microwave ablation system probe,42295144,Microwave surgical units,
,61287,Microwave ablation system generator,42295144,Microwave surgical units,
,61324,"Bone-screw internal spinal fixation system, sterile",42321507,Internal bone fixation sets,
,61325,"Bone-screw internal spinal fixation system, non-sterile",42321507,Internal bone fixation sets,
,61375,Cranial port/reservoir,42293507,Surgical suction reservoirs,
,61376,"Intracerebral infusion/drainage catheter, long-term",42295601,Cerebral ventricular or hydrocephalus drainage catheters or adapters,
,61398,Intracerebral sensor catheter,42203402,Diagnostic or interventional vascular catheters for general use,
,61399,"Intracerebral infusion/drainage catheter, short-term",42295601,Cerebral ventricular or hydrocephalus drainage catheters or adapters,
,61401,Intracerebral catheter cranial-fixation kit,42296107,Cranial clamps,
,61425,"Laparoscopic trocar, single-use",42294979,Surgical trocars for general use,
,61440,Intracerebral trocar,42294979,Surgical trocars for general use,
,61465,"Internal spinal fixation system cable, non-sterile",42321507,Internal bone fixation sets,
,61523,Lumboperitoneal shunt,42295512,Surgical implantable shunts or shunt extenders,
,61556,"Sleeve femoral/tibial extension, coated",4231710,#N/A,
,61622,"Intraluminal circular stapler, reusable",42312009,Medical staplers for internal use,
,61623,"Haemorrhoidal surgical stapler, reusable",42312009,Medical staplers for internal use,
,61624,"Open-surgery manual linear cutting stapler, reusable",42312009,Medical staplers for internal use,
,61668,"Orthopaedic bone staple, non-adjustable, non-sterile",42321514,Bone fixation staples,
,61668,"Orthopaedic bone staple, non-adjustable, non-sterile",42321514,Bone fixation staples,
,61669,"Orthopaedic bone staple, non-adjustable, sterile",42321514,Bone fixation staples,
,61670,"Orthopaedic bone washer, non-sterile",42321509,Orthopedic washers,
,61671,"Orthopaedic bone washer, sterile",42321509,Orthopedic washers,
,61688,"Internal orthopaedic fixation system, plate/screw, non-bioabsorbable, sterile",42321507,Internal bone fixation sets,
,61689,"Internal orthopaedic fixation system, plate/screw, non-bioabsorbable, non-sterile",42321507,Internal bone fixation sets,
,61690,"Internal orthopaedic fixation system, cerclage wire/cable, sterile",42321507,Internal bone fixation sets,
,61691,"Internal orthopaedic fixation system, cerclage wire/cable, non-sterile",42321507,Internal bone fixation sets,
,61754,"Vascular embolization coil detacher, reusable", ,#N/A,
,61785,Cardiac radio-frequency ablation system catheter,42203416,Cardiac ablation catheters,
,61797,Lumbar cerebrospinal fluid drainage catheterization kit,42295603,Lumbar cerebrospinal fluid drains or kits,
,61798,Ventricular cerebrospinal fluid drainage catheterization kit,42295453,Surgical drains or drain sets,
,61800,"Arthroscopic shaver system blade, reprocessed",42295216,Surgical shaver equipment or handpiece accessories,
,61801,"Blood pressure cuff, reprocessed",42181605,Blood pressure cuffs or bladders,
,61809,"Single-chamber venous compression system garment, reprocessed",42142801,Vascular sequential compression devices or tubing,
,61810,"Multi-chamber venous compression system garment, reprocessed",42142801,Vascular sequential compression devices or tubing,
,61811,"Diagnostic ultrasound cardiac catheter, steerable, reprocessed",42201711,Medical ultrasound or doppler or echocardiograph transducers or accessories,
,61812,"Electrocardiographic lead, reprocessed",42181702,Electrocardiography EKG adapters or cables or leads,
,61813,"Laparoscopic trocar/sleeve, reprocessed",42294979,Surgical trocars for general use,
,61814,"Laparoscopic trocar, reprocessed",42294979,Surgical trocars for general use,
,61817,"Endoscopic electrosurgical handpiece/electrode, bipolar, reprocessed",42294924,Endoscopic monopolar or bipolar hand instruments,
,61823,"Suture/needle passer, reprocessed",42292904,Surgical suture or wire passers or related products,
,61825,"Tourniquet cuff, reprocessed",42295311,Surgical tourniquet or vascular occluder or ligator accessories,
,61845,"Soft-tissue ultrasonic surgical system holder/tip, reprocessed",42295167,Surgical suction machine or vacuum extractor or ultrasonic Surgical aspirator or regulator accessories,
,61854,Intracerebral cannula,42291711,Ventricular cannulas or needles,
,61869,"Open-surgery electrosurgical handpiece/electrode, monopolar, single-use",42295104,Electrosurgical or electrocautery equipment,
,61872,"Endoscopic electrosurgical electrode, bipolar, single-use",42294910,Endoscopic monopolar or bipolar cable,
,61875,"Endoscopic electrosurgical electrode, monopolar, single-use",42294910,Endoscopic monopolar or bipolar cable,
,61917,Osteotomy guide,42312120,Ostomy measuring guides or cards,
,61945,Corn dressing,42311515,Hydrocolloid dressings,
,61951,"Endoscopic electrosurgical electrode, bipolar, reprocessed",42294910,Endoscopic monopolar or bipolar cable,
,61952,Intravenous pole device connector,42222105,Intravenous or arterial line pole or stand accessories,
,62109,Endoscopic oesophageal dilator,42294909,Endoscopic dilators or inflation devices,
,62116,Red/blue light phototherapy mask system,42143713,Phototherapy units,
,10718,"Eustachian catheter, single-use",,#N/A,
